标题,播放,评论,回馈率（‰）,分词后标题
台民众受骗柬埔寨，中国使馆出手，民进党当局叫嚣绝不让人代劳,13000.0,1.0,0.0769230769230769,台 民众 受骗 柬埔寨 ， 中国使馆 出手 ， 民进党 当局 叫嚣 绝不 让 人 代劳
【国家电网】哪种取暖电器最省电？,348000.0,1456.0,4.183908045977011,【 国家电网 】 哪 种 取暖 电器 最省 电 ？
跟警察合影需要注意些什么呢？,408000.0,58.0,0.142156862745098,跟 警察 合影 需要 注意 些 什么 呢 ？
青年理性发声！维护国家主权没有“局外人”,358000.0,460.0,1.2849162011173183,青年 理性 发声 ！ 维护 国家主权 没有 “ 局外人 ”
直击国产新型智能弹药试验现场：火光四射 均质装甲板瞬间被击穿,16000.0,22.0,1.375,直击 国产 新型 智能 弹药 试验 现场 ： 火光 四射   均质 装甲 板 瞬间 被 击穿
“没有美国参与的中东”！美媒：与美国人权灌输不同，中国对话政策很有吸引力,1905.0,1.0,0.5249343832020997,“ 没有 美国 参与 的 中东 ” ！ 美媒 ： 与 美国 人权 灌输 不同 ， 中国 对话 政策 很 有 吸引力
姚洋谈国企“二道贩子”现象，拿下项目不干活，转包给民企，对此，你怎么看？,212000.0,179.0,0.8443396226415095,姚洋谈 国企 “ 二道贩子 ” 现象 ， 拿下 项目 不 干活 ， 转包 给 民企 ， 对此 ， 你 怎么 看 ？
科幻照进现实！《流浪地球2》武器装备全解析,250000.0,1387.0,5.548,科幻 照进 现实 ！ 《 流浪 地球 2 》 武器装备 全 解析
中国仅有5株5000岁古树都在陕西,98000.0,31.0,0.3163265306122449,中国 仅 有 5 株 5000 岁 古树 都 在 陕西
张杰《想见你想见你想见你》：全新演绎击中内心，千万个时间线里都是想见你。#声生不息宝岛季  正在热播中！#声生不息宝岛季开播,19000.0,9.0,0.4736842105263157,张杰 《 想见 你 想见 你 想见 你 》 ： 全新 演绎 击中 内心 ， 千万个 时间 线里 都 是 想见 你 。 # 声生 不息 宝岛 季     正在 热播 中 ！ # 声生 不息 宝岛 季 开播
注意！抑郁症不易察觉的症状,39000.0,37.0,0.9487179487179488,注意 ！ 抑郁症 不易 察觉 的 症状
美国人卖不了的我来卖，美国人凑不齐的装备我来凑，啥？中式合成旅整体首次打包销售,188000.0,597.0,3.175531914893617,美国 人卖 不了 的 我 来 卖 ， 美国 人 凑 不齐 的 装备 我来 凑 ， 啥 ？ 中式 合成 旅 整体 首次 打包 销售
《你好，中国风》,83000.0,71.0,0.8554216867469879,《 你好 ， 中国 风 》
茶叶中藏着怎样的中国智慧？,329000.0,287.0,0.8723404255319149,茶叶 中藏 着 怎样 的 中国 智慧 ？
遍地是红旗！法国近百万民众大罢工,1490000.0,3815.0,2.5604026845637584,遍地 是 红旗 ！ 法国 近 百万 民众 大 罢工
“中国能防得住他国核打击”,1145000.0,2876.0,2.5117903930131007,“ 中国 能防得 住 他国 核打击 ”
乌士兵被俘后略显青涩供述是被抓上战场，吃饭时居然还给分发可乐,1057000.0,682.0,0.6452223273415326,乌 士兵 被俘 后 略显 青涩 供述 是 被 抓 上 战场 ， 吃饭 时 居然 还给 分发 可乐
广西一男子带鼠连过多个障碍，最后精准传“球”给狗子,3951.0,2.0,0.5062009617818274,广西 一 男子 带鼠 连过 多个 障碍 ， 最后 精准 传 “ 球 ” 给 狗子
茅台丁雄军：我们存了几十万吨茅台基酒，价值相当于好多万亿,230000.0,537.0,2.334782608695652,茅台 丁雄军 ： 我们 存 了 几十万吨 茅台 基酒 ， 价值 相当于 好多 万亿
兔狲探会之宪法宣誓篇：经典镜头创作有哪些鲜为人知的故事？,44000.0,11.0,0.25,兔狲 探会 之 宪法 宣誓 篇 ： 经典 镜头 创作 有 哪些 鲜为人知 的 故事 ？
波兰欲出兵打俄，危急时刻普京迎来强援？30万枚炮弹1亿子弹到位,8396.0,16.0,1.905669366364936,波兰 欲 出兵 打 俄 ， 危急 时刻 普京 迎来 强援 ？ 30 万枚 炮弹 1 亿 子弹 到位
洪都拉斯国会副议长：洪都拉斯立场明确 台湾是中国的一部分,3974.0,1.0,0.2516356316054353,洪都拉斯 国会 副议长 ： 洪都拉斯 立场 明确   台湾 是 中国 的 一部分
我国科学家首次发现月球新矿物并命名为“嫦娥石”,1158000.0,1198.0,1.0345423143350605,我国 科学家 首次 发现 月球 新 矿物 并 命名 为 “ 嫦娥 石 ”
港媒高層團｜訪深比亞迪「試車」　讚國產製造力非凡,60000.0,64.0,1.0666666666666669,港媒 高層團 ｜ 訪深 比亞迪 「 試車 」 　 讚 國 產 製 造 力 非凡
中国军队国际形象网宣片《PLA》发布！,1354000.0,379.0,0.2799113737075332,中国 军队 国际形象 网宣片 《 PLA 》 发布 ！
【卢克文工作室】河南人的痛苦，只有河南人自己知道,6163000.0,63000.0,10.222294337173452,【 卢克文 工作室 】 河南人 的 痛苦 ， 只有 河南人 自己 知道
她走了22年，这些小品台词我们还能接得上,634000.0,683.0,1.0772870662460567,她 走 了 22 年 ， 这些 小品 台词 我们 还 能 接得 上
官方也困惑！印度4男子轮奸稀有巨蜥 手机录拍发指行为成为罪证,554000.0,942.0,1.7003610108303249,官方 也 困惑 ！ 印度 4 男子 轮奸 稀有 巨蜥   手机 录 拍发 指 行为 成为 罪证
墨西哥总统：美国人也知道，墨西哥比美国更安全！,18000.0,7.0,0.3888888888888888,墨西哥 总统 ： 美国 人 也 知道 ， 墨西哥 比 美国 更 安全 ！
巴西总统卢拉：必须有人讨论和平，因为美欧不谈和平,76000.0,21.0,0.2763157894736842,巴西 总统 卢拉 ： 必须 有人 讨论 和平 ， 因为 美欧 不谈 和平
网友在进藏火车上看到的一幕：护路员身背重物向列车敬礼。辛苦了！,137000.0,180.0,1.313868613138686,网友 在 进藏 火车 上 看到 的 一幕 ： 护路 员 身背 重物 向 列车 敬礼 。 辛苦 了 ！
难得一见！探秘国产95-1式自动步枪生产线,167000.0,245.0,1.4670658682634732,难得一见 ！ 探秘 国产 95 - 1 式 自动步枪 生产线
美国不习惯听真话，更不愿正视自身的问题,443000.0,57.0,0.128668171557562,美国 不 习惯 听 真话 ， 更不愿 正视 自身 的 问题
冯远征：就任北京人艺院长后，再没接过外面的戏,96000.0,54.0,0.5625,冯远征 ： 就任 北京人艺 院长 后 ， 再 没 接过 外面 的 戏
云南的咖啡不仅可以喝还可以炒菜,19000.0,14.0,0.736842105263158,云南 的 咖啡 不仅 可以 喝 还 可以 炒菜
再次正告！外交部：若佩洛西“访台”，解放军绝不会坐视不管,239000.0,21.0,0.0878661087866108,再次 正告 ！ 外交部 ： 若佩洛西 “ 访台 ” ， 解放军 绝不会 坐视不管
“打卡”重庆光环购物公园，外国总领事们赞叹：现代化！有活力！,5582.0,4.0,0.7165890361877463,“ 打卡 ” 重庆 光环 购物 公园 ， 外国 总领事 们 赞叹 ： 现代化 ！ 有 活力 ！
俄罗斯面面观 | 莫斯科跳蚤市场烟火气满满,3743.0,3.0,0.8014961261020571,俄罗斯 面面观   |   莫斯科 跳蚤市场 烟火 气 满满
营养餐给山区孩子带来了什么？支教老师拍的视频看哭网友,69000.0,115.0,1.6666666666666667,营养餐 给 山区 孩子 带来 了 什么 ？ 支教 老师 拍 的 视频 看 哭 网友
RT鹅军哥|AEK-971——昙花一现的特种突击步枪,9744.0,10.0,1.026272577996716,RT 鹅军哥 | AEK - 971 — — 昙花一现 的 特种 突击 步枪
日本突然重新清点岛屿，称多出7000多座,239000.0,74.0,0.309623430962343,日本 突然 重新 清点 岛屿 ， 称 多出 7000 多座
这是一份来自家喻户晓的学霸的试卷……,433000.0,197.0,0.4549653579676674,这是 一份 来自 家喻户晓 的 学霸 的 试卷 … …
过去24小时 解放军都做了什么？,1029000.0,2072.0,2.0136054421768708,过去 24 小时   解放军 都 做 了 什么 ？
美国姑娘穿汉服跳“卷珠帘”太惊艳！不爱迪士尼：想成为中国公主,15000.0,10.0,0.6666666666666666,美国 姑娘 穿 汉服 跳 “ 卷 珠帘 ” 太 惊艳 ！ 不爱 迪士尼 ： 想 成为 中国 公主
这个特别版本的错位时空真的听到泪奔！致敬英烈，铭记历史！,81000.0,315.0,3.888888888888889,这个 特别 版本 的 错位 时空 真的 听到 泪奔 ！ 致敬 英烈 ， 铭记 历史 ！
台湾民众怒了：在民进党施政下，活得一点尊严都没有！,26000.0,124.0,4.769230769230769,台湾 民众 怒 了 ： 在 民进党 施政 下 ， 活 得 一点 尊严 都 没有 ！
外交部宣布制裁佩洛西,79000.0,5.0,0.0632911392405063,外交部 宣布 制裁 佩洛西
我们拿文心一言和chatGPT比了比，结果是…,7058.0,15.0,2.1252479455936526,我们 拿 文心 一言 和 chatGPT 比 了 比 ， 结果 是 …
蔡英文欲窜美，大陆直接摊牌了，已改变对她的称呼，用意值得细品,365000.0,258.0,0.7068493150684931,蔡 英文 欲 窜 美 ， 大陆 直接 摊牌 了 ， 已 改变 对 她 的 称呼 ， 用意 值得 细品
欧洲议员发出灵魂拷问：我们是要与中国打仗么？这对我们有什么好处？我们有毛病吧？,2653000.0,788.0,0.2970222389747455,欧洲 议员 发出 灵魂 拷问 ： 我们 是 要 与 中国 打仗 么 ？ 这 对 我们 有 什么 好处 ？ 我们 有 毛病 吧 ？
普京：2022年俄罗斯对外贸易额增长8.1%，全年实现贸易顺差3320亿美元,15000.0,11.0,0.7333333333333334,普京 ： 2022 年 俄罗斯 对外贸易 额 增长 8.1% ， 全年 实现 贸易顺差 3320 亿美元
《声生不息·宝岛季》杨宗纬《鹿港小镇》抚平游子乡愁，愿霓虹灯照亮回家的路,8727.0,6.0,0.6875214850464078,《 声生 不息 · 宝岛 季 》 杨宗纬 《 鹿港 小镇 》 抚平 游子 乡愁 ， 愿 霓虹灯 照亮 回家 的 路
福建舰最新画面曝光，舰体被熏黑有2好消息，电磁阻拦超美福特级,44000.0,156.0,3.545454545454546,福建 舰 最新 画面 曝光 ， 舰体 被 熏黑 有 2 好消息 ， 电磁 阻拦 超美福 特级
王建煊:我当选后立即谈判和平统一 我们就叫中华人民共和国台湾特别行政区,292000.0,788.0,2.698630136986301,王建煊 : 我 当选 后 立即 谈判 和平统一   我们 就 叫 中华人民共和国 台湾 特别 行政区
儿子研制神舟飞船送爸爸上太空！,34000.0,36.0,1.0588235294117647,儿子 研制 神舟 飞船 送 爸爸 上 太空 ！
一招自测发际线是否正常，科学记录发量变化,700000.0,1626.0,2.322857142857143,一招 自测 发际 线 是否 正常 ， 科学 记录 发量 变化
俄罗斯面面观 | 探访莫斯科购物中心：西方品牌撤出后 中国品牌填补空缺,44000.0,76.0,1.7272727272727273,俄罗斯 面面观   |   探访 莫斯科 购物中心 ： 西方 品牌 撤出 后   中国 品牌 填补空缺
【中国天团】狙击枪上放弹壳，她能坚持70分钟不掉落！,81000.0,7.0,0.0864197530864197,【 中国 天团 】 狙击枪 上放 弹壳 ， 她 能 坚持 70 分钟 不 掉落 ！
久居中国的美国人如何看待中美关系,47000.0,172.0,3.6595744680851054,久居 中国 的 美国 人 如何 看待 中美关系
种业翻身仗是什么“仗”？这“仗”怎么打？,290000.0,1369.0,4.720689655172414,种业 翻身仗 是 什么 “ 仗 ” ？ 这 “ 仗 ” 怎么 打 ？
正衣冠、盥洗礼、叩首礼、束脩礼……古人的拜师礼有多讲究,22000.0,28.0,1.2727272727272727,正 衣冠 、 盥洗 礼 、 叩首 礼 、 束脩 礼 … … 古人 的 拜师 礼有 多 讲究
38年前的今天，五星红旗首次在南极飘扬！,1096.0,2.0,1.8248175182481752,38 年前 的 今天 ， 五星红旗 首次 在 南极 飘扬 ！
听INTO-1刘宇《春风予你》，让雷锋精神常驻心间,129000.0,965.0,7.48062015503876,听 INTO - 1 刘宇 《 春风 予 你 》 ， 让 雷锋精神 常驻 心 间
那年今日，刘胡兰英勇就义！,19000.0,316.0,16.63157894736842,那年 今日 ， 刘胡兰 英勇 就义 ！
