标题,播放,评论
中俄深化合作后，美国马上增加对乌军援，对策核心是和中国抢台词,4.3万,241
泰国政府VS中国网红，谁在说谎，最担心的事还是发生了,10.2万,4831
这个“全网最冷门专业”到底有多“冷”？,6.6万,54
5名央企领导人员被查！,2.5万,20
教育部等五部门：禁止中小学校举办或参与举办培训机构,4.3万,21
中方提出帮俄实现振兴，普京：满足中国能源需求，帮中企取代西企,21.2万,322
“无能为力了！”捷克总统表示：援乌已到极限，没有劳动力生产武器,4598,5
烈士牺牲40年，战友不间断代其看望父亲“我们都是您的儿子”,2.7万,13
泽连斯基想和中方谈谈，美国表示反对：不能让中国调停俄乌冲突,10.8万,70
秦刚：中国式现代化一不靠战争二不靠殖民三不靠掠夺,23.6万,2423
中俄元首会晤，2条线10项合作，普京态度大转变！美2高官将访华,17.3万,508
我国两栖爬行动物又添新物种，来自云南19个新成员曝光,6849,8
新华社重磅微纪录片《民主之光》,43.3万,0
美国妄想中国做它的跟班，赖岳谦：中国人几千年来从来不当跟班,17.7万,169
孙笑川回应因孙笑川吧被网友攻击 ：人在家中坐，锅从天上来,13万,234
李大钊生前唯一活动影像彩色修复,55.6万,3463
用生命兑现誓言！汶川地震获救男孩扑救湖南山火牺牲,10.4万,208
【全国爱耳日】勤掏耳朵是好习惯吗？,27.9万,263
独家揭秘军人勋表生产监督一线！,3433,3
凶多吉少，tiktok不被禁，得帮美国军工直播带货,6.1万,414
浪漫！40秒看天宇上演“星月神话”：金星被月亮暗边缘慢慢掩盖,721,1
大金融大科技为保国家安全？中美对抗难避免，中国不能重蹈俄覆辙,3.3万,45
【相对论】90后用AR眼镜装配中国空间站,4.3万,35
四月为爱奔赴洛阳！赏牡丹+听汪峰唱歌，感受音乐与视觉的冲击！,7666,5
乌士兵致电阵亡的俄军士兵母亲：他被炸的尸骨无存，说完哈哈大笑,132.3万,1469
00后女生被上司性骚扰，拒绝未果搜集证据举报：领导道歉，已离职,2万,14
【追光者】珍贵影像，你见过周总理说英语吗？,32.6万,0
汪淼与史强之间的羁绊，都在这一首《1874》,7698,13
