标题,播放,评论
“玩火者”佩洛西,160.8万,4958
现场视频丨习近平出席俄罗斯总统举行的欢迎仪式,5.4万,0
【大国外交最前线】中美元首会晤向世界释放了何种信号？,18.6万,0
到底什么是专家？来听听他们说……,14.2万,245
结局亮了 | 男子记错号码误拨警察电话买毒品......,50.6万,166
严禁最先进设备出口！荷兰加强向中国供应光刻机的限制,1.2万,9
高启强都不敢碰！《狂飙》中的毒奶茶有多毒？,76.9万,319
外交部组织多国驻华使节代表团访渝 重庆获盛赞“我简直无法形容这里的美”,4万,16
网络上对于我们当兵的打雪仗是有误解的。,29.1万,138
中央网信办：要着力解决自媒体内容失真问题，堵住骗取网民捐赠的自媒体牟利途径,18.8万,372
【完整版】中国国务院新总理李强首场中外媒体记者会，坦言中国经济5%的增长目标并不轻松，用八个字概括中国经济前景：长风破浪，未来可期,21.5万,0
中国军队国际形象网宣片发布,383.6万,0
欧洲领导人开始密集访华，俄乌问题上无视中国态度已经不可能,29.9万,877
满满的民族自豪感！中国留学生晒俄罗斯护送队 场面壮观,31.2万,61
当屠夫杀猪的时候，猪却双脚跪下乞求放过。网发：不杀流泪牛不屠跪拜猪！,20.4万,35
谭谈就业,91.5万,2012
这类首饰，不能随便买！涉嫌违法,11.7万,100
“416女团”一开口国潮氛围感拉满了,23.4万,297
【石原里美得子】石原里美顺利生产当妈 孩子性别生日尚未公开,21.5万,264
用户要求打真车？翼龙无人机：安排！,49.6万,2158
旅行者荧点上一首《走马》，优菈：“不复刻的这个仇，我记下了”,16.5万,77
亚裔认为中国落后，伦敦小伙：听我说，我来告诉你什么是中国！,26.8万,166
【第一视角】人的双手只有这么大，却载满了希望！,4.4万,28
台民众受骗柬埔寨，中国使馆出手，民进党当局叫嚣绝不让人代劳,1.3万,1
【国家电网】哪种取暖电器最省电？,34.8万,1456
跟警察合影需要注意些什么呢？,40.8万,58
青年理性发声！维护国家主权没有“局外人”,35.8万,460
直击国产新型智能弹药试验现场：火光四射 均质装甲板瞬间被击穿,1.6万,22
