标题,播放,评论
我国新直升机快来了！,34.9万,194
解放军舰队完整绕圈日本岛，蔡正元：收集军事资料顺便震慑右翼,13.3万,92
英国通胀持续失控，移英港人生活苦不堪言，正准备重回香港故土,18万,523
【完整监控】网约车司机曝光：女乘客情绪激动辱骂司机，“乘客定位出错怪我吗?”,39.2万,6063
7分钟视频，回顾神舟十五号载人飞船奔赴“天宫”之路,1.3万,16
再见2022，你好2023！,17.3万,0
13岁女孩遭多人霸凌左耳鼓膜穿孔，眼睛被插入异物造成不可逆损伤，对此，你怎么看？,4153,20
外交部质问美国：你是不是有难言之隐？,12.1万,83
中俄深化合作后，美国马上增加对乌军援，对策核心是和中国抢台词,7.7万,337
宋涛谈统一后安排，台当局拒不接受，回应当天，台军举行巷战演习,8855,19
【完整版】中国国务院新总理李强首场中外媒体记者会，坦言中国经济5%的增长目标并不轻松，用八个字概括中国经济前景：长风破浪，未来可期,20.4万,0
李强简历,17.9万,0
10天9夜！蔡英文确定“出访”中美洲 ，将“过境美国”,7.9万,52
俄罗斯空降工兵旅硬核排雷,7.1万,145
余华王安忆谈ChatGPT：AI写作完美但平庸，人脑最可贵的是会犯错,3401,2
王毅痛批美国！连巧取都没有了，只剩下豪夺,3万,22
斯卡蒂为博士点上一首《天黑黑》,8063,8
俄乌冲突进入第4个月，普京真正目的清晰了，不止占领乌30%领土,26万,190
美国最大水库枯竭 惊现多具藏尸,117.8万,915
台海上演紧张对峙，岛内军事学者：解放军在增兵巴士海峡,2.6万,36
击毁“海马斯”，俄军打掉的不只是一门炮，更是乌克兰军队的信仰,36.8万,325
【追光者】周恩来总理与老朋友相见时的样子，你见过吗？,23.3万,0
两会关心啥：我国56%耕地缺钾！钾肥储备该如何完善？！,14.3万,189
50多岁大叔干重活自带盒饭 一段话让人心酸,55.9万,48
中华小当家原型陈建一去世！ 是他让日本人爱上麻婆豆腐,4万,301
男子缅甸务工失联 家属心急如焚 竟在诈骗新闻照里发现他！,6.5万,8
硬核！新娘在婚礼上宣传禁毒,34万,81
辽宁省原副省长郝春荣一审被控受贿1883万余元 其当庭认罪、悔罪,6万,18
